[
  {
    "id": "insignificant-cover",
    "name": "Insignificant Cover",
    "examples": "Wood furniture/doors, body shields, etc.",
    "armorPoints": 5,
    "damageReduction": 0,
    "source": {
      "book": "Player's Survival Guide",
      "system": "mothership-1e",
      "version": "1.2",
      "page": 28,
      "section": "28.4"
    }
  },
  {
    "id": "light-cover",
    "name": "Light Cover",
    "examples": "Trees, bulkhead walls, metal furniture, etc.",
    "armorPoints": 10,
    "damageReduction": 0,
    "source": {
      "book": "Player's Survival Guide",
      "system": "mothership-1e",
      "version": "1.2",
      "page": 28,
      "section": "28.4"
    }
  },
  {
    "id": "heavy-cover",
    "name": "Heavy Cover",
    "examples": "Airlock doors, cement beams, ships, etc.",
    "armorPoints": 20,
    "damageReduction": 5,
    "source": {
      "book": "Player's Survival Guide",
      "system": "mothership-1e",
      "version": "1.2",
      "page": 28,
      "section": "28.4"
    }
  }
]
